Key,Film Title,Year,Production,Type,Topic,Plot Summary
da li 、 xiao li he lao li,大李、小李和老李,1962,Tianma Film Studio,Feature,9,某肉类加工厂工会主席大李和车间主任老李不爱体育，只有老李的儿子青工小李爱体育超过爱工作。大李被选为体协主席后，也积极参加了体育锻炼，出了不少洋相。老李见大李不但不阻拦他认为是闹着玩的体育运动，反而也热衷于体育锻炼，心里很着急，怕在厂内开展体育活动妨碍了生产，便企图通过大李的妻子秀梅去影响大李。不料却起了相反的效果，大李通过一张体育宣传画说服了秀梅。小李也由此得到启发，在老李的房间里到处贴满了体育宣传画。一次，大李请老李去参加广播操，老李借故去冷藏库检查工作，被小李无意中关在库里，冻得他直打哆嗦，竟不自觉地做起了广播操。后来，通过体育晚会，老李在事实的感召下成为太极拳的爱好者。在一次体育运动会上，老李亲自出马参加比赛。有五个孩子的母亲秀梅也赢得了自行车比赛第一名。从此，体育活动在工厂里蓬勃地开展起来了。
dong jin xu qu,东进序曲,1962,August First Film Studio,Feature,2,一九四零年，新四军挺进纵队东进抗日途中，在苏北桥头镇遭到国民党苏鲁皖部阻扰。敌副总指挥刘玉坤受顽固派蒋公任等人唆使，执迷反共。挺进纵队司令孟器宇派政治部主任黄秉光与敌人谈判，被对方扣留。与此同时，刘派兵袭击挺进纵队，遭到惨败，敌第二纵队司令石中柱被俘。刘欲加罪于不愿打内战的第一纵队司令周明哲，周率众起义，乃使新四军主力顺利过江。日伪密使汪光夏乘机诱逼刘降日反共。这时，躲避于他处的敌总指挥刘世仪赶回，在我统一战线政策的影响下，同时为了保全其实力，向被囚禁的黄秉光赔罪，表示愿意停止内战，共同抗日。黄回到纵队，新四军继续东进。
ge lia hao,哥俩好,1962,August First Film Studio,Feature,9,陈大虎、陈二虎是孪生兄弟，同时参军又被分配到一个连队，大虎在八班，二虎在二班。二虎活泼、任性，自由散漫，他和大虎偷换武器：又误将军长当成炊事员，要和军长换领章;在帮助林大娘做豆腐时，他冒冒失失地把豆腐做坏，闯了一个祸。大虎怕二虎受处分，就代替二虎承担了过错，为的是叫二虎好好练射击，为二班争得荣誉后再去坦白，不料二虎在打靶时没及格。大虎的射击成绩优秀，民兵来向他学习时，误把二虎当成大虎，闹出了一场笑话。二班长雷利金虽然多次帮助二虎，但由于急躁、主观，工作方法简单粗暴，收效甚微。后经指导员和军长的耐心启发、教育，二虎终于克服了缺点。兄弟俩都成了{QUOTE}五好战士{QUOTE}。
huai shu zhuang,槐树庄,1962,August First Film Studio,Feature,0,一九四七年，北方某农村槐树庄的农民在共产党员郭大娘，刘老成等领导下，进行土地改革。从小被郭大娘奶大的地主家庭出身的国家机关干部崔治国，看到他的地主家庭被清算，极为不满，企图压制土改运动。郭大娘带领群众同崔治国进行斗争，终于完成了土地改革。六年后，在农业合作化运动中，老党员刘老成满足于眼前的单干生活，不愿走合作化道路。郭大娘帮助刘老成认识到错误，成立了农业合作社。一九五七年反右派斗争时，崔治国煽动槐树庄一心想走个人{QUOTE}发家致富{QUOTE}道路的富裕中农李满仓等攻击合作化，反对郭大娘，以闹退社、改选合作社领导为名，在槐树庄制造混乱，郭大娘在上级党组织的领导下，与崔进行斗争，并使生产获得发展，崔治国被划为右派分子，送回槐树庄监督劳动。一九五八年槐树庄成立人民公社，郭大娘当选为社长，去北京参加群英会。
di lei zhan,地雷战,1962,August First Film Studio,Feature,13,抗日战争时期，我胶东抗日根据地边缘赵家庄和附近几个村庄，经常受到日寇的袭击和{QUOTE}扫荡{QUOTE}，无法生产，民不聊生。在区武委雷主任的领导下，赵家庄和附近几个村庄组成民兵联防，与日寇展开武装斗争。赵家庄民兵队长赵虎，发动群众，创造了各种土地雷，根据不同情况布下雷阵，沉重地打击了日寇。日军中队长中野吃了几次亏以后，特地从青岛搬来了工兵，破坏了民兵的地雷阵，攻入赵家庄，进行烧杀抢掠，使群众受到惨重损失。赵虎接受了失败的教训，改进了地雷技术，创造了土化学雷，粉碎了敌人起雷的阴谋。麦收时节，敌人乘联防民兵抢收麦子的机会，偷袭了赵家庄，掳走一部分村民。接着，又妄想用土匪绑票办法，让被俘村民在队伍前踏地雷，胁迫民兵放下武器。赵虎将计就计，巧摆地雷阵。当走在敌人队伍前面的群众踏着踏板的时候，地雷却在后面的敌群里爆炸。民兵们经过一场激烈的战斗，终于解救了被俘的群众，并配合八路军歼灭了进犯的敌人，粉碎了敌人的{QUOTE}扫荡{QUOTE}。
e er duo si feng bao,鄂尔多斯风暴,1962,August First Film Studio,Feature,10,一九一六年，内蒙古鄂尔多斯草原的统治者王爷及夫人福晋。为最后消灭牧民们闹减租减息的{QUOTE}独贵龙{QUOTE}运动，杀害了{QUOTE}独贵龙{QUOTE}运动的领袖敖其尔。十年后，敖其尔的儿子乌力记长大成人，乌力记的妹妹乌云花被王爷抓去当女奴，乌力记离开草原，到北平段祺瑞政府告状，反遭辱打。正当他气愤而又彷徨无路的时候，巧遇{QUOTE}三·一八{QUOTE}爱国运动的游行队伍，他和示威群众一起被军警逮捕。在狱中他结识了地下党员刘洪太，在刘的启发下，他出狱后回草原组织{QUOTE}独贵龙{QUOTE}运动。开始因为没有武装，斗争经验不足，遭敌暗算，乌力记被俘。在赴刑场途中，来草原开展革命工作的刘洪太带领群众将他营救出来。之后，乌力记和刘一起组织牧民武装，准备攻打王府。由于叛徒告密，王爷勾结陕北军阀陈大权，企图消灭牧民武装。在王府内当女奴的乌云花将{QUOTE}独贵龙{QUOTE}失密的消息告诉了乌力记，于是乌力记将计就计，调虎离山，乘王府兵力空虚，一举攻下王府。
bi hai dan xin,碧海丹心,1962,August First Film Studio,Feature,0,一九四九年，人民解放军第四野战军某部钢铁一连，在连长肖汀的带领下，追击国民党残兵来到雷州半岛南端，因没有船只，无法渡过琼州海峡，解放彼岸的海南岛。一次，肖汀意外发现五只渔船，他求战心切，动用了这些船，而忽视了群众纪律，受到养父丁司令员的批评，后在当地渔民的帮助下，战士们进行海上训练，克服了晕船的困难。第二年，在解放海南岛的战斗中，肖用木船渡海战斗，在海上与敌舰相遇，肖将满载炸药的木船绕到敌后，炸毁敌旗舰，胜利登上海南岛。
ying xiong tan ke shou,英雄坦克手,1962,August First Film Studio,Feature,12,一九五二年，中国人民志愿军某坦克排长张勇，在奉命去某高地配合步兵作战途中，自己驾驶的坦克与整个车队的联系被切断，只好单车冲破层层封锁，到达前沿阵地。之后，他又单车深入敌阵地，大胆插进敌坦克群，击毁敌坦克。继之，又冒着随时有被发现的危险，单车伏击敌人。在伏击中，坦克兵克服酷热、干渴、疲劳等困难，最后用手榴弹炸毁敌坦克，完成了任务。
han jiang hua si jin,韩江花似锦,1962,Pearl River Film Studio,Opera,7,《王茂生进酒》{LINE_CUT}农民王茂生，逃荒避税流落在长安城外。一天，偶然得知新的平辽王府主人就是薛仁贵，忙告诉妻子毛氏准备前去祝贺。原来十八年前王茂生曾周济过落魄的薛仁贵，两人情同手足。但毛氏担心相别日久，且两手空空不好登门。茂生却认为除道贺和叙旧之外并无所求，不妨走走。于是他们以水代酒，作为贺礼。夫妻赶到王府门前，门官见他们衣衫褴褛不懂礼仪，把他们拒之门外，茂生和门官吵起来。毛氏急中生智，乘机把拜帖送进王府。薛仁贵见拜帖大喜，传令给茂生夫妇换上新衣，大开中门，亲自迎接，文武官员也立刻对茂生换了一副阿谀面孔。{LINE_CUT}席前，仁贵听说茂生送来一坛美酒，即命当堂斟上。茂生屡阻无效，狼狈不堪。好在仁贵重义，百官奉承，尽管是水，大家还是一再干杯，连称{QUOTE}好酒{QUOTE}。{LINE_CUT}《闹开封》{LINE_CUT}开封府王佐受理了巡天侯府公子李天福控告张普{QUOTE}截劫{QUOTE}侯府花轿，放走诈婚骗财的张石一案。经过质询，才知李天福强抢民妇不遂，反诬善良。王佐要李天福招供具结。李天福之母邢氏闻讯赶来，威吓知府翻案，王佐劝解无效，只得再传张石等上堂对质。李天福理屈词穷，把张石踢死。王佐令扣押凶徒。邢氏唆使恶仆刺杀张普以灭人证，不料误将李天福杀死，邢氏颠倒黑白，逼迫王佐上朝见君，为子报仇。王佐意识到后果严重，然而为民伸冤，为国护法的正义感鼓励他毅然升堂释放无辜。邢氏恶谋未遂，自毁冠衣，大闹开封，诬陷王佐。王佐决心抛却乌纱，冒灭族之罪也要为民除暴。他亲手锁了邢氏，下令鸣锣开道，直上金殿。沿途，万民称快，愿为清官后盾。
nan hai chao,南海潮,1962,Pearl River Film Studio,Feature,15,解放前，在国民党统治时期，农民之女阿彩与渔民之子金喜相爱，渔霸高仁利的儿子高子端以索债为名，欲霸占阿彩。阿彩和金喜在老赤卫队队员张伯的帮助下结了婚。{QUOTE}七七事变{QUOTE}前夕，高子端企图借海匪王大炮之手杀害阿彩和金喜。张伯发动群众起来斗争，保护了阿彩夫妇。{QUOTE}七七事变{QUOTE}后，张伯组织了游击队去前方作战，高家父子威逼金喜等下海捕鱼。渔民在海上遭到日寇洗劫，金喜被日寇打伤，逃出后又被国民党军队作为壮丁抓走，阿彩也被日寇掳去，中途被金喜的哥哥金水救出，后找到张伯，随张伯去游击区。
qi wang qiu jiang,齐王求将,1962,Pearl River Film Studio & Hong Kong Hongtu Film Company,Opera,3,东周列国时，齐宣王听信夏太师和夏妃的谗言，贬杀忠良，还下令将有功于国的娘娘钟离春绞死。七年后，列国诸侯看到齐宣王昏庸无道，战备松弛，乘机大举进犯。齐宣王忙召集文武百官商议退兵之计，无奈文武官员谁都不肯上阵。{LINE_CUT}在走投无路时，他只得召回七年前被贬为庶民的老相国田婴。{LINE_CUT}田婴引导宣王回忆当年助他稳坐江山的钟娘娘，并领他到钟娘娘灵前祈祷。原来钟娘娘当年被田婴所救，在无盐郡隐居，朝夕练兵，现得知大敌压境，就跟田婴商议好计策，惩戒宣王，在他们的摆布下，宣王中神箭，遭{QUOTE}鬼{QUOTE}打，被弄得狼狈不堪。最后钟离春出来与宣王相见，提出重整朝纲，驱除奸佞的条件，宣王应允、钟离春这才挂帅出兵。{LINE_CUT}夏妃听说钟离春复生了，知道自己和父亲的地位岌岌可危，就让宣王为她父女作主，宣王应允。此事被田婴得知，暗中写信告诉了钟离春。钟凯旋归来时，再施妙计教训宣王。宣王表示悔悟，钟离春才和他一起回朝。
hong ye ti shi,红叶题诗,1962,Pearl River Film Studio & Hong Kong Hongtu Film Company,Opera,1,南宋末年，礼部尚书姜华的独生女姜玉蕊，对当时朝廷妥协偏安深为忧虑。某日，与丫环翠霞同到花园赏春解闷，随手拾得一片傲经风霜的红叶，在红叶上题诗一首，付以流水，寄托情怀。正在游湖取乐的御弟七王见玉蕊美貌，垂涎欲滴。已故兵部侍郎的公子文东和，因考中状元未被封官，心中闷闷不乐，此时也从湖中经过，拾得红叶，对叶上诗句赞叹不止，欲凭红叶去寻访忧国忧民的佳人，结为知音。{LINE_CUT}文、姜两府原是世交。姜华寿诞之日，东和与母亲同到姜府贺寿，他从翠霞口中探知红叶上的诗句乃玉蕊所题，并在翠霞的帮助下，和玉蕊相会，两人志同道合，私订终身。随后东和托媒婆到姜府说亲，姜华接下聘礼。此时，圣旨传来，七王奏选玉蕊为妃，玉蕊宁死不从。姜华畏惧七王威势，只好劝女顺从。东和得知此事，怒气填膺，动本参奏七王，未成，反被除掉状元之名，贬归琼州。{LINE_CUT}玉蕊见此情景，自知无路可走，与东和一起投湖殉情。
sheng ming de huo hua,生命的火花,1962,Xi'an Film Studio,Feature,8,解放初期，烈士后代女青年刘海英参加了开发边疆的队伍，来到新疆天山脚下的国营农场。一次，海英因下河抢救溺水儿童身体受冻，关节炎病复发，手脚和耳朵都被冻坏，几乎成了残废。正当她的病有些转机时，不料在一个狂风暴雨之夜，山洪暴发，海英奋力抢救国家财产，两条病腿又因长时间在寒水中浸泡和劳累过度，而瘫痪了。这使她陷入绝望之中。后经其父生前老战友、现农场场长的启发和鼓舞，她以坚强的意志和乐观精神战胜疾病，恢复了健康，重新回到工作岗位。
shang xiao yun wu tai yi shu,尚小云舞台艺术,1962,Xi'an Film Studio,Opera,4,《昭君出塞》{LINE_CUT}京剧《汉明妃》中的一折。{LINE_CUT}西汉元帝的妃子王昭君出国和番。当时汉室文官无能，武官怕战，元帝无奈，只得命昭君前去和番。昭君出于大义，慷慨出使，一路备受长途跋涉之苦。{LINE_CUT}《失子惊疯》{LINE_CUT}《失子惊疯》是传统剧目《乾坤福寿镜》中的一折。{LINE_CUT}明朝成化年间，颍州知府的夫人胡氏，怀孕十四个月未娩。妾徐氏乘机诬胡氏怀妖孕，会招致家门不祥，设计欲杀害胡氏。使女寿春得知消息，保护胡氏逃出。途中胡氏产下一子。正当寿春去为婴儿买糕干时，胡氏被巴山强盗抢上山去，婴儿为宁武总镇林鹤拾去。后，胡氏跑下山发现婴儿已丢失，遂惊急成疯，多年后，胡氏入都，婴儿亦已长大成人，凭他颈上佩带的{QUOTE}乾坤福寿镜{QUOTE}，母子相认。
qiao tai shou luan dian yuan yang pu,乔太守乱点鸳鸯谱,1962,Emei Film Studio,Feature,7,宋朝时期，在一次庙会上，秀才孙润与少女刘慧娘互相爱慕，秀才裴政与少女徐文姑一见钟情。两对情人在互赠信物时，因庙会中人多杂乱，孙润误将白扇递给了文姑，文姑的罗帕被孙润接去：慧娘的罗帕给了裴政，裴政的白扇到了慧娘手中。因此，他们都弄错了自己所爱之人的姓名。恰巧，父母给他们包办的婚姻是孙润配徐文姑，裴政配刘慧娘，所以四个人都以为订婚的对方是自己的意中人。{LINE_CUT}孙润有姐名叫珠姨，早与刘慧娘之兄刘璞订下婚约，刘家因刘璞久病不愈，要将珠姨接过门来冲喜。珠姨怕刘璞一病不起，不肯上轿，孙润男扮女装，代姐出嫁。刘慧娘女扮男装代兄拜堂*洞房之夜，慧娘与孙润发现对方正是自己朝思暮想的意中人，于是假夫妻成了真夫妻。事情泄露后，引起了刘家与孙家、裴家与刘家、徐家与孙家等一连串的争吵。大家来到公堂，请乔太守断案。由于案情复杂，弄得乔太守左右为难，后来他干脆来个乱点鸳鸯。结果正好将慧娘配给孙润、徐文姑配给裴政、珠姨配给刘璞，大家都感到很满意。
bing shan shang de lai ke,冰山上的来客,1963,Changchun Film Studio,Feature,15,一九五一年，一股匪特企图从新疆某山口入境。匪首阿曼巴依利用古兰丹姆与边防战士阿米尔童年时青梅竹马的恋爱关系，先派一女特务，冒充早年流浪在外的古兰丹姆潜入境，刺探情报，配合匪特偷越边防。我边防军杨排长识破匪特诡计，并根据这个线索，掌握了敌情。匪特第一次偷越计划失败后，骗取了真古兰丹姆信任的匪首阿曼巴依亲自护送真古兰丹姆回乡。为了灭口，他们派人杀死假古兰丹姆，又以为真古兰丹姆和阿米尔举行婚礼之名，企图在当地的巴罗脱节，里应外合，袭击我边防哨所。杨排长将计就计，布下天罗地网，将这股匪特一网打尽，并使离别八年的古兰丹姆和阿米尔的心愿得以实现。
hua wei mei,花为媒,1963,Changchun Film Studio,Feature,12,王俊卿与表姐李月娥私订终身。王母托阮妈为俊卿说亲。阮妈替他说了才貌双全的张五可，俊卿不允张家亲事，思念月娥，忧虑成疾。王母又托阮妈去月娥家说亲。月娥之父李茂林拒此婚事。俊卿闻知，病情更重，王母心急如火。阮妈献计去张家花园相亲，让俊卿看见五可才貌，便会喜爱五可。无耐俊卿病重，不能前往，请其表弟贾俊英代为相亲。{LINE_CUT}俊英来到张家花园，五可见他英俊文雅，赠与红玫瑰私订终身。俊英将红玫瑰转赠俊卿，俊卿拒不接受。阮妈又向王母献策，先将五可娶来。王母应允，定期迎娶。月娥得知，痛苦万分。月娥母乘其父不在家中，采用冒名送女之计，抢先将月娥送到王家与俊卿拜堂成亲。待五可的花轿到来时，他们早已拜完花堂。五可大怒，立即闯进洞房，质问俊卿。阮妈见此情景不知如何是好，突然发现贾俊英，遂即将他拖入洞房，两对情人各遂心愿。
zi you hou lai ren,自有后来人,1963,Changchun Film Studio,Feature,3,一九三九年，在日寇统治下的东北一个城市里，住着一家祖孙三代人，这一家并不同姓，是共同的斗争和阶级命运把他们联结在一起。为将一份密电码送交游击队，我地下交通员铁路工人李玉和遭叛徒王巡长出卖被捕。日寇宪兵队长鸠山迫降未得逞，提着礼物来到李家，企图利用母子之情，从李母的手里骗出密电码，被富有斗争经验的李母识破骗局。于是，敌人将李母与孙女铁梅抓走。之后，鸠山为李玉和一家三代安排了一次会面，想暗中窃听密电码的下落。祖孙三人在狱中相会，互诉衷情，道出三人原非一家人。鸠山见毫无结果，杀害了李和李母，佯释铁梅，并派叛徒王巡长与铁梅联系，企图从年幼的铁梅手里骗取密电码。铁梅根据王受伤的左臂，认出王是出卖父亲和奶奶的叛徒，她机智地将皇历冒充密电码，骗走了叛徒。然后乘机跑出去取出密电码，送交给游击队，完成了父亲和奶奶未完成的任务。
chao yang gou,朝阳沟,1963,Changchun Film Studio,Opera,8,银环和栓保在高中学习时相爱。毕业后栓保回乡参加农业生产，当他来接银环时，银环因母亲反对，犹豫不定，经过思想斗争，终于随栓保来到朝阳沟。银环妈随后赶来，逼银环回去。老支书把银环妈劝走，让银环暂时留下。银环初参加劳动，手上打了血泡，却得到了社员们的鼓励，心中有些沾沾自喜。{LINE_CUT}几天过后，由于劳动的艰苦，银环的热情渐渐消失，思想产生了动摇。正在这时，银环妈来信说卧病在床。{LINE_CUT}银环乘机离开了朝阳沟，一路上她触景生情，想起老支书的鼓励和公婆的挽留，感到有些羞愧。回到城里，见到母亲并未生病，是想骗她回城另找工作。她非常气愤，当天返回农村。银环妈见女儿意志坚定，也从城里搬到农村安家落户了。{LINE_CUT}秋天，朝阳沟获得了大丰收。银环经过劳动锻炼，认清了知识青年在农村的广阔前途。
wo men cun li de nian qing ren (xu ji),我们村里的年轻人（续集）,1963,Changchun Film Studio,Feature,1,副大队长高占武带领孔家庄的年轻人劈山引水，改变了家乡缺水面貌，继而又提出要在村里修建水电站。思想保守的老社长认为修电站是高不可攀的事，以劳力、资金缺乏为由表示反对。公社赵书记采纳了年轻人的建议，派高占武负责修建水电站的工作。村里办了电气化训练班，全村掀起了学{QUOTE}电{QUOTE}的热潮。李克明接受了设计水电站图纸的任务，经过一番苦战，完成了图纸设计，外村来学习的冯巧英却批评李的设计华而不实，为此两人发生争吵。经高占武的帮助，两人和解并产生了爱情。在高占武的带领下，孔家庄的年轻人不仅把自己家乡的水电站修起来了，同时还派孔淑贞和李克明去支援邻村建设电站。一天，高占武突然接到未婚妻孔淑贞从周村寄来一封退婚的信，村里的年轻人都以为是李克明搞的鬼。李克明从周村回来，被弄得莫名其妙，经曹茂林解释，才知道李的对象是冯巧英。原来孔淑贞在支援周村修电站工作中把腿砸伤，她唯恐连累高占武，便给高写了一封退婚的信。高占武得知这个消息后，立即去医院看孔淑贞，消除了误会。后来，孔淑贞伤愈回村。秋收时，孔家庄粮食获得大丰收，孔家庄的年轻人在劳动、学习、友谊、爱情等各方面进一步成长起来。
man yi bu man yi,满意不满意,1963,Changchun Film Studio,Feature,0,苏州{QUOTE}得月楼{QUOTE}餐厅服务员杨友生，看不起服务性行业，消极怠工，经常给顾客送错饭菜，还不承认错误。经过优秀服务员沈师傅和同志们的批评帮助，他又从一个极端走到另一个极端，一变冷颜相对为{QUOTE}笑脸相迎，笑脸相送{QUOTE}，他造作的{QUOTE}笑容{QUOTE}吓跑了好多顾客，落得意见簿上一大堆的批评。为此，他要改行，又没能如愿，不小心反把脚摔伤。休养期间，沈师傅用今昔对比教育他，伤愈后，他因穿错了沈师傅的工作服，被人家误请去做报告。经过这场误会，他终于从思想上找到病源，对服务行业有了正确的认识，改变了服务态度。
liang jia ren,两家人,1963,Changchun Film Studio,Feature,15,高正国和陈为邦解放前都是贫苦的农民，解放后积极参加土改，领导互助生产。高女二珠和陈子小海相处得也很好。土改后，随着生活的好转，高正国滋长了{QUOTE}个人发家致富{QUOTE}的思想，搞单干、积粮、置地、雇长工。陈为邦对高正国的错误思想曾几次三番进行教育帮助，但高正国充耳不闻。老农会警告他不能走所谓{QUOTE}富一家，穷千家{QUOTE}的资本主义老路，高认为社会上应该{QUOTE}有富有穷{QUOTE}。在卖余粮的问题上，二珠跟父亲展开了顽强的斗争，使父亲被迫卖了余粮。高正国为捞回卖余粮的亏损，又拼命拉脚搞副业，并买了单干户贫农李存的土地。这时，农业合作化运动开始了。过去吃了单干亏的李存老汉第一个报名入社，没想到老伴李大妈背着他把地卖了。心地狭窄的李大妈自知做错了事，愁得走投无路，投井自杀。高正国亲眼看到李存老汉家的遭遇，又通过陈为邦用今昔对比对他的教育，使他终于将李存的土地证交还原主，并参加了农业合作社。高、陈两家人又象从前那样和睦相处，亲如一家。
qiang tou ma shang,墙头马上,1963,Changchun Film Studio,Opera,5,唐代裴尚书之子裴少俊，代父前往洛阳为皇上修建御花园挑选奇花异草，与李相国之女李倩君一见钟情，俩人结下墙头马上之盟。当倩君听说其父已将她许配给杜丞相之子后，在丫环梅香和乳娘的帮助下，与少俊私奔。少俊天性怯弱，怕父亲不答应这桩婚事，把倩君私藏在后花园中。一日，裴尚书去后花园游赏，发觉儿子偷娶妻室，以无媒苟合、伤风败俗之名，要将倩君送到官府问罪；继之又叫倩君用玉簪麻针、游丝系银瓶，故意刁难。少俊赶到，向父亲求情，尚书反而逼少俊写休书。少俊被逼无奈，只得忍痛提笔在纸上点上一点。倩君见少俊居然肯写，愤然离去，尚书又逼少俊立即进京赴考，然后乘四周无人，假冒儿子之名写了休书，将倩君赶走。后来，少俊中了状元，李相国得知与其女私奔的就是少俊，转怒为喜，命少俊娶其女。裴尚书听说被他赶走的倩君原来是李相国的女儿，亲自到城外清虚观接倩君。倩君不从，定要少俊亲自去迎她，少俊释开写休书的误会，倩君这才跟着少俊回家。裴尚书和李相国出门迎接倩君，两人俱有窘态。
