Key,Film Title,Year,Production,Type,Topic,Plot Summary
xi cheng de gu shi,锡城的故事,1959,Changchun Film Studio,Feature,2,云南彝族少年普根强和同伴李阿朵，因家里欠了人家的债，被骗到锡矿当童工。李阿朵的妹妹阿梅寄住在普根强家里。普根强和童工们忍受不了非人的生活，欲逃出虎口，未成。普根强在一次干活时晕倒，被工头毒打致伤，幸得党的地下工作者、矿工万忠和杨德贵的关怀，才恢复健康。不久，矿主陈寿亭与另一矿主刘火神争夺矿藏，工头刘德才竟灭绝人性地以辣椒烟熏矿洞，企图窒息在对方矿洞里的矿工。万忠奋不顾身地与狗腿子搏斗，使矿工们免遭杀害。日寇侵华期间，陈寿亭的矿山被炸毁，矿工被遣散。普根强回到家乡，就在他跟阿梅成亲的那天，陈寿亭又带着狗腿子来抓矿工。普母为保护儿子逃走，被陈踢死。普根强流落到一个小镇上，又遇到了万忠。经万忠介绍，普根强在古头山煤矿做钳工，在万忠的领导下，他积极参加了工人运动。买办资本家吕震南勾结反动军阀，杀害了罢工运动的领导者杨德贵。普根强根据党的指示，和万忠一起参加了游击队，消灭了吕震南、陈寿亭。解放后，普根强与阿梅幸福地团聚了。
xiao zhu yan kai,笑逐颜开,1959,Changchun Film Studio & Harbin Film Studio,Feature,5,某建筑工程队的家庭妇女，积极响应党的号召，纷纷走出家庭，参加社会劳动，做新社会的主人。这一来，在每个家庭里都引起了波动。居民组长何慧英的爱人丁国才轻视妇女，认为老婆就该在家里生儿育女，侍候丈夫。他买来收音机、小人书想拴住妻子，没想到何慧英一心想为社会主义建设出力，决定参加妇女工程队。丁国才一怒之下，赶走了妻子。不少家庭也闹起纠纷。何慧英在工地领导和劳动模范高彩凤的帮助下，耐心做思想工作，以实际行动团结教育反对自己的胡桂贞；说服态度生硬的技术员小罗；教育不愿干活的王丽云。劳动改变了这些家庭妇女的精神面貌，也提高了她们的社会地位。为了参加竣工典礼，王丽云的丈夫张会计忙着为妻子找一身漂亮大方的衣服；不关心国家大事的胡桂贞拉着儿子问什么叫哲学；小罗和丈夫小马亲热地在一起搞技术革新；丁国才也转变了态度与何慧英言归于好，帮助她搞机械化，还为妻子买来了新自行车。
shi hang,试航,1959,Changchun Film Studio,Feature,2,某造船厂为造万吨轮，在进口内燃机上，受到外商的刁难。轮机车间青年工人兰英和小李给他们的师傅——全国有名的劳动模范王万水贴大字报，批评王万水有旧思想。厂党委书记刘子健为制造内燃机的事，去拜访邢总工程师。邢有崇洋思想，认为光靠本国造不出三千马力的内燃机。恰在这时，西欧有个国家愿意卖给我国内燃机图纸，刘闻讯前往北京，由于对方条件过于苛刻，谈判没有成功。在这种情况下，造船厂工人们与技术人员结合，不到一个月，就设计出内燃机图纸。在苏联专家西蒙诺夫的帮助下，他们克服了许多困难，终于在国庆前夕，试航成功。
bing shang jie mei,冰上姐妹,1959,Changchun Film Studio,Feature,1,隆冬，在东北某城市的全省冰上运动会上，新手丁淑萍出人意外地战胜了连获数年冠军的老手王冬燕。某中学学生于丽萍向王冬燕请教滑冰，王为夺回失掉的冠军，加倍苦练，因此拒绝了于丽萍的请求。丁淑萍则主动热心地对于丽萍进行指导。数日后，丁淑萍应邀到某中学做滑冰表演，于丽萍才知道指导她滑冰的就是丁淑萍。不久，于丽萍参加了业余训练班，在丁淑萍的指导下，进步很快，就渐渐骄傲起来，受到丁淑萍的批评，于赌气离开了训练班。在一次爬山练习中，丁淑萍为救王冬燕，腿部摔伤住进了医院。于丽萍深受感动，赶到医院向丁淑萍检讨自己的过失。不久，丁淑萍到海滨疗养。这期间，丁淑萍发现她所爱的歌唱家罗林，正默默地爱着于丽萍，她决定放弃对罗的感情。当于丽萍知道这个秘密后，很苦恼，也有意和罗疏远。丁淑萍疗养回来后，批评了于丽萍，使于和罗重新和好。后来，丁淑萍和王冬燕的哥哥王冬舟相爱。一年后，丁淑萍、于丽萍和王冬燕一同参加全国冰上运动会，于故意让丁取得五百公尺冠军，丁批评于不该把个人友谊置于国家荣誉之上。在三千公尺比赛时，王冬燕刷新了全国纪录，丁及时鼓励于，最后两人都突破王冬燕创造的全国纪录，于获得冠军。
jie qin pei,借亲配,1959,Changchun Film Studio,Opera,7,张桂英为葬父，将自身卖与王正魁为奴，王正魁逼她为妾，桂英不依，王限期五日后和她成亲。{LINE_CUT}王正魁的表弟李春林，丧妻之后，家道中落，上京赶考苦无路费。一天，春林在街上碰到岳父胡定国，岳父以为他已续弦，嘱他带了新娘上门认亲，并答应送他纹银三百两作为上京路费。春林碍于面子，未对岳父讲明实情。回家后，愁闷妻子不知从何而来，忽然想起信陵君借兵救赵的故事，便来到表哥家借妻。王正魁被他纠缠不休，只好借张桂英给他，企图乘机榨取李春林的银子。李春林带着张桂英来到胡定国家，胡定国夫妇见桂英长得很像自己女儿，对她倍加疼爱，留宴留宿。李春林推辞不得，桂英却真的爱上了善良的春林，她向春林作了种种暗示，使春林了解了她的身世和遭遇，二人真的结为夫妻。王正魁到县衙控告李春林强占人妻，桂英当堂认定李春林是自己的丈夫，并机智地与县官和王正魁进行辩论。最后由胡定国出庭作证，县官只好成全了桂英和春林的婚姻。
wu duo jin hua,五朵金花,1959,Changchun Film Studio,Feature,15,白族青年阿鹏在云南大理的{QUOTE}三月街{QUOTE}盛会上结识了金花，两人定情于蝴蝶泉边，约定翌年山茶花开季节再相见。第二年，阿鹏如期赴约，未见到金花，但又不知金花的姓名、地址。于是，他走遍了苍山、洱海，接连找到四个金花：先是和积肥模范金花产生了一段有趣的误会；又和爱唱歌的畜牧场金花演了一场引人发笑的闹剧；炼钢厂金花由于对他的过份热情关照，使丈夫产生了误会，引起许多笑话；拖拉机手金花和另一个拖拉机手举行婚礼的时候，阿鹏赶到，副社长金花也在场，她还是婚礼的证人。阿鹏误以为自己心爱的人和别人结婚了，决定离开此地，而副社长金花也以为他变了心。当阿鹏扫兴地即将离开这儿的时候，曾经闹过误会的炼钢厂金花和她的爱人找到了阿鹏，帮助他们释开了误会。最后，在他们定情的蝴蝶泉边，阿鹏找到了他心爱的姑娘——副社长金花，其他四个金花也来到泉边为他们真挚的爱情祝福。
feng cong dong fang lai,风从东方来,1959,Changchun Film Studio & Moscow Film Studio,Feature,15,工地主任王德民与苏联专家马特维也夫在兴建水电站过程中，与特大洪水搏斗。在一同指挥战斗中，两个人回忆起往事：十月革命时期，王德民在苏联险被白匪杀害，马特维也夫搭救了他，他参加了苏联红军。后来他们又一起参加过星期六义务劳动，受到列宁的接见。若干年后，两人又在中国某水电站工地相遇。王德民的儿子王晓在苏联留学，与苏联同学卡莉娜来工地看望父母(卡莉娜的母亲安娜也在水电站工地工作)，途中遇险，后被渔民救起。在中、苏两国专家和工作人员的共同合作下，终于战胜了洪水，建成了水电站。
cao yuan chen qu,草原晨曲,1959,Changchun Film Studio & Inner Mongolia Film Studio,Feature,12,日寇侵占内蒙时，蒙族青年胡合、加米扬和汉人张玉喜领导牧民保卫白云鄂博的矿藏，与敌人进行斗争。后，三人被日寇抓去。胡合的妻子张秀芝帮助他们越狱逃跑，秀芝的哥哥张玉喜在逃跑途中中弹牺牲。胡合遵照张玉喜的嘱托，将张女小玲交给胡母，然后，告别了老母和怀孕的妻子，去大青山加入抗日游击队。胡妻秀芝也被迫迁出草原。十多年后，内蒙解放了，胡合回到了家乡，担任矿山的党委书记。胡母早已去世。小玲已被牧民拉西宁布抚养成人，改名娜布其。娜布其和胡合的儿子张祥都参加了勘探队，但父子相见不相识。拉西宁布是胡合的好友，他受坏人道尔吉的挑拨，反对开采白云鄂博，并影响了当地的部分群众。后在胡合的帮助和事实的教育下，拉西宁布终于认清了道尔吉的面目，揭露了道尔吉的阴谋。娜布其和胡合的义子关其卡相爱着。最后，娜布其将张祥的母亲张秀芝从远方接来，夫妻、父子相认，一家人得以团聚。
huang he fei du,黄河飞渡,1959,Changchun Film Studio & Inner Mongolia Film Studio,Feature,8,甘肃某县农村年年遭受旱灾，白云乡的领导人王凯、侯金彪等决心把黄河水引上北岸高山。北岸农民在县委的统一指挥下，为修建一个横跨黄河的输水工程，克服了不少困难，工程进展迅速。南岸清水乡不大缺水，清水乡的领导人丁富贵对炸山开渠不大热心。二十年前丁为修渠查看过黑虎山，被摔个半死，王凯的父亲为了修渠死在黑虎山，现在丁负责的黑虎山工程因故迟缓。为了迅速打开黑虎山工程，王凯率白云乡民工支援丁富贵。在抢渡黄河屡遭失败后，王凯去请富有经验的丁富贵。起初，丁不肯出马，在女儿秀娥的激励下，才出来与儿子俊才奋战黑虎浪，渡过了黄河天险，在黑虎山炸开立足点。在一次爆破中，俊才腰上的保险绳断了，从山上摔了下来，王凯英勇地抱住俊才，从山上跳入黄河，俊才被救。在南北两岸的农民通力合作下，终于炸开了黑虎山，建成了横跨黄河的大渡槽，引水飞渡黄河，使干旱的土地得到灌溉。
zhao xia,朝霞,1959,Changchun Film Studio,Feature,6,新华小学年轻的新任校长林征，上任不久就从五年级学生华小川因上课迟到，被班主任江老师罚做值日这件事上，发现江老师的教育思想不对头。林征为贯彻市委的{QUOTE}勤工俭学{QUOTE}指示，在校内办起小工厂，遭到了江老师和某些家长的反对。江认为应该加强课堂教育。在第一次劳动中，因为有几个学生请假，江老师更有了反对勤工俭学的理由。华小川在哥哥的帮助下，和张晨、金大宝、刘海燕几个同学自己动手试做了一批钉子。这件事使江老师很伤心，她担心这样下去，学生更不好好学习了。后来在林征和市委刘书记的帮助下，江老师看到原来学习不好的华小川、金大宝，以及她很宠爱的娇生惯养的学生方明珠，通过勤工俭学的锻炼，获得了知识，培养了刻苦耐劳精神，学习成绩都有所提高，终于使她改变了以前的错误看法。
yun wu shan zhong,云雾山中,1959,Changchun Film Studio,Feature,3,大西南解放后，匪首吴八凭借云雾山区天险，进行垂死挣扎。为消灭匪特，解放军某部排长田冬生率领一排战士，去云雾山区吴家寨侦察，田因援救一位被匪特抓去的农民方有志而被捕。后，田设法与方一起逃出匪巢。接着，田又化装成匪联络官第二次打入匪巢，机智地应付敌人，并在一个被迫当匪兵的农民的帮助下，抓获了匪特的一个小头目，最后配合大军全歼了匪特。
qing yun qu,青云曲,1959,Changchun Film Studio,Feature,6,青年飞行员杜春林担任老飞行员赵盛的僚机。赵是小杜的教员，有丰富的空战经验，但因骄傲自满和思想保守，在第一次出击美蒋的空战中，影响双机配合，徒失战机。事后，赵不但不检查自己，反而批评小杜，使小杜很难过。在第二次空战中，小杜获得战机，请求攻击。但赵死守长机攻击、僚机掩护的规定，命令小杜掩护，自己攻击，结果不仅贻误战机，反使小杜的飞机受伤。经过战术思想大辩论，赵认识了错误。在第三次空战中，两人密切配合，击落敌机多架。在战斗中，赵盛的飞机负伤，敌机企图乘机攻击赵。小杜当即迎战，将敌机击落，使赵安全返航，但小杜的飞机却因油已用完，无法返回机场。师长命令小杜跳伞，他为了保护国家财产，勇敢地架机滑翔，终于使飞机安全着陆。
san kan hu die meng,三勘蝴蝶梦,1959,Changchun Film Studio,Opera,0,皇亲葛彪驰马撞倒王老先生，反诬王撞了他的马。王与之评理，葛彪令其弟葛三将王打死。王母及三个儿子要葛彪偿命，葛彪蛮不讲理，被王氏三兄弟打死。葛三及衙役把三人锁往县衙。县令和葛父共同审案，将王氏三兄弟判成死罪。开封府尹包拯路过本县，王母向他告状，包公审理此案，却无人敢出来作证。包公又问三个兄弟中是谁打死了葛彪？三人争担罪责。包公只好判王大为葛彪偿命，王母不肯；改判王二，王母也不肯；改判王三，王母应允。包公怀疑王三非王母所生，逼王母讲实情，王母无奈，只好讲出王大、王二乃王老先生前妻之子，王三是她所生。包公深为感动，决定再详查此案。{LINE_CUT}是夜，包公梦见三只小蝴蝶被风刮到蜘蛛网上，其中两只挣脱，最小的一只被网缠住，大蝴蝶只好带着两只小蝴蝶飞开；包公将最小的蝴蝶搭救了，于是四只蝴蝶感恩拜谢飞去。{LINE_CUT}包公醒来，惊奇梦境恰似王母舍亲生。他经过调查，终于弄清案情，遂将王三释放，将葛三处死。
hai shang shen ying,海上神鹰,1959,Changchun Film Studio,Feature,3,一九五四年，在解放东南沿海某岛屿的战斗中，我军某部刘排长和侦察员马海、杨兵三人，越海深入敌岛，侦察敌情，活捉了敌少校作战参谋高志洋。敌人发现高志洋失踪，四处搜索。刘排长等化装成敌军，在渔民洪家父女的帮助下，将敌少校押回大陆，最后一举全歼岛上敌人。
dou e yuan,窦娥冤,1959,Changchun Film Studio,Opera,6,窦娥自幼丧母，婚后不久，丈夫病故，两代孀居，婆媳相依为命。{LINE_CUT}一天，蔡婆去向赛芦医索债。赛芦医谋财害命，蔡婆被当地恶棍张驴儿父子所救。但张驴儿挟恩逼婚，要她们婆媳坐堂招夫。婆媳不依，张驴儿便想毒死蔡婆，独占窦娥。不料毒药为其父误饮至死。蔡婆赠给张驴儿纹银十两，以买棺葬父。而张驴儿却以此银两为凭，讹诈蔡婆害死他父，又贿赂县令桃杌，对蔡婆横施酷刑。窦娥恐婆婆受刑不过，只得含冤屈招至死。死后，应其誓言：血溅素练；三伏时节，瑞雪纷飞；楚州地面，干旱三年。六年后，窦娥之父窦天章考中了状元，路过山阳。当晚，窦天章正审阅案卷，忽见女儿窦娥前来，求父代她伸冤。次日，窦天章开堂，重审此案，案情大白。张驴儿和桃杌被判死刑，赛芦医充军，窦娥冤屈得伸。
jin yu ji,金玉姬,1959,Changchun Film Studio,Feature,15,抗日战争时期，朝鲜族抗联女战士金玉姬带领一小队抗联战士，在长白山区打击敌人，并俘获了日寇山本旅长。后，领导派她和参谋金兆铭下山筹粮。金兆铭在残酷的斗争面前经不住考验，投降了敌人。金玉姬不仅完成了筹粮任务，还宣传了革命道理，带回了小李子等不少要求参加抗联的青年。由于金兆铭长久未归，部队决定转移。金玉姬的丈夫、抗联支队的崔队长，在掩护部队转移途中牺牲。不久，金玉姬又主动向上级提出留在敌区坚持地下斗争。由于叛徒金兆铭的出卖，金玉姬不幸被捕，受尽了日寇的种种毒刑，但她毫不屈服。后来山本旅长的妻子由东京赶来，为打探丈夫的消息，亲自审讯金玉姬，结果一无所获，便将金玉姬枪杀了。小李子的母亲李大娘在祭奠烈士时，发现金玉姬尚未断气，就将她救了出来，藏入山洞。伤愈后，金玉姬又进入煤矿领导工人斗争，并惩罚了叛徒。抗战胜利后，金玉姬回到了家乡延吉，与久别的小李子和老战友重逢，继续进行革命斗争。
huan le ren jian,换了人间,1959,Changchun Film Studio,Feature,0,魏大爷带着女儿秀兰从关内逃荒来到东北，在日伪统治下的煤矿做工。魏女秀兰嫁给青年矿工小王，在新婚之日，小王死于矿井瓦斯爆炸。过了一个时期，秀兰和矿工何正纲结婚，婚后生下一女，取名淑芳。不久，何正纲也死于矿井瓦斯爆炸，秀兰遭到第二次沉重打击。矿工鲁万春帮助了秀兰一家，两人渐渐建立了深厚的感情，万春的义子江明也和淑芳成了好朋友。但是，秀兰不愿万春为自己吃苦，带着女儿淑芳回到山东老家。解放后，秀兰又带着女儿来到东北寻找失散多年的父亲，见到了魏大爷和已成为劳动模范的鲁万春。鲁万春带领工人们制伏了瓦斯爆炸，秀兰参加了矿上的工作，并和万春结为夫妻，淑芳也和江明结了婚。
zhan huo zhong de qing chun,战火中的青春,1959,Changchun Film Studio,Feature,6,一九四七年，在解放战争的某次战斗中，民兵小队长高山的父亲(区委书记)壮烈牺牲。为了报仇，高山女扮男装，参加了解放军，并担任尖刀英雄排副排长。排长雷振林有个人英雄主义，轻视瘦小的副排长高山，不论什么任务，他总不放心让高山去，但高山每次却都出色地完成了任务。一次战斗中，雷振林带队插入敌人营部，打了一个胜仗，洋洋得意。高山却指出这是一种鲁莽行为，雷很不高兴。不久，在袭击敌军的战斗中，雷因盲动被敌围困，高为营救他而负伤。事后，雷去医院慰问，发现高竟是个女同志，深受感动。在解放全国的进军中，老战友雷振林把心爱的指挥刀送给高山留作纪念。高山脉脉含情地望着雷振林渐渐远去的背影。
liu shui huan ge,流水欢歌,1959,Changchun Film Studio,Feature,6,东北某农村山脚社修水电站缺少技术指导。山脚社水利委员高小玲与近邻沙原社的土专家小豆相爱，她去请小豆作技术指导，遭到了沙原社副主任田有亮的拒绝。小玲又去县里请专家，半路上却碰到小豆，原来小豆就是县委派给山脚社的土专家。田有亮误以为山脚社拉他们的干部，对山脚社很不满意。小豆在帮助山脚社进行电站水位勘测时，发现两社水位落差大，须从沙原社把河水引过来。有本位主义思想的田有亮想利用沙原河水修水库，让河水为沙原社服务。而小豆却从大局考虑，提出两社合修水库、合用水电的方案，遭到田有亮的拒绝。后来，田有亮在党组织和群众的帮助下，认识了自己的错误。于是，两社合作，建成了水电站。
qian shao,前哨,1959,Changchun Film Studio,Feature,9,美蒋特务机关为了盗窃我军东南沿海地区的军事情报，派遣了一个代号叫四零四的特务组织，潜入某镇进行阴谋活动。我军侦察机关根据发现的情况，派侦察员古大鹏化装成镇上饭店服务员，去侦察特务的接头情况。某部团参谋长耿坚的保姆蔡美美是特务黄七的情妇，蔡在黄七的唆使下，企图盗窃耿坚的公文包，被抓获；黄七也被同伙勒死。四零四特务组织的头目蒋人俊指使四二、四三号特务冒充我军区干部来团部了解我作战计划，偷拍军事地图，也被逮捕。为了将特务一网打尽，古大鹏又化装成已死的四一号特务，带着信物和拍有军事地图的胶卷，深入虎穴，先被狡猾的特务头子蒋人俊打昏，醒来后与蒋展开了机智的斗争，终于得到了蒋的信任。最后，古协同我公安人员和解放军，将特务和金门派来接应的敌人全部歼灭。
chen san liang,陈三两,1959,Changchun Film Studio,Opera,2,年迈的珠宝商人张子春，在五定州的富春院买红妓陈三两为妾，三两誓死不从。张子春向知州李凤鸣行贿，李得贿银，威胁三两。三两不服，表示宁死不离五定州。李凤鸣逼问她不离五定州的原因，三两说出当年在富春院曾亲自教过落魄书生陈奎读书，她要等待做官后的陈奎。{LINE_CUT}李凤鸣不相信陈三两会有此等文才，经当场试验，发现陈三两的笔迹好像胞姐李素萍的手笔，连想到姐姐自幼精通黄帝内经，遂拿出黄帝内经进行试探，果然二人是同胞姐弟。但双方都不愿相认。李凤鸣想到自己是朝廷的五品官，岂能认烟花女子。陈三两也不愿认贪官污吏的弟弟。正在这时，按台陈奎巡抚到此，三两、陈奎相会。李凤鸣见势不妙，才认姐姐。但是三两铁面无情，陈奎秉公断案，将李凤鸣削职为民。
shuai jing jia,摔镜架,1959,Changchun Film Studio,Opera,1,《摔镜架》是拉场戏传统节目《回怀记》中的一折。{LINE_CUT}明朝嘉靖年间，王二姐的未婚夫张廷秀赴京赶考，王二姐在绣楼中思念夫君，以及听到张廷秀回来之后的喜悦心情。
lin jia pu zi,林家铺子,1959,Beijing Film Studio,Feature,15,一九三一年，日本武装侵略中国，全国各地的青年学生掀起了抵制日货的风潮，国民党反动派乘机进行敲诈勒索。江南古镇上的商店林老板贿赂镇上商会的余会长，取得出售日货的默许。林老板用改头换面的大拍卖、{QUOTE}一元一套{QUOTE}等种种手段，挤垮资本小的同行，同时又受到钱庄的高利盘剥，和国民党官宪的敲诈，女儿明秀也险些被警察局长强占。在这场尔虞我诈、大鱼吃小鱼的争斗中，林家铺子倒闭，林老板带着女儿出走躲避。受到更大打击的还是更下层的穷苦人，张寡妇、朱三太这些老弱孤寡存放在林家铺子里的款子，白白被林老板拐骗走了。
wu ming dao,无名岛,1959,Beijing Film Studio,Feature,0,一九五八年秋，蒋军登陆舰{QUOTE}太成{QUOTE}号进犯大陆，被我福建前线海军鱼雷快艇撞沉。敌舰长吴约翰、枪炮长冯占魁等五人游到无名岛的北岛上，等待援救。前来援救他们的敌水鬼抓了一条渔船和渔民蔡大爷来到岛上。我海军指导员王永智和鱼雷手林茂材，押着俘虏孙贵接踵而至，登上了无名岛的南岛，与北岛的敌人相距咫尺。在敌众我寡的形势下，王永智争取主动，向敌人展开了政治攻势。在这个过程中，受到宽大和教育的俘虏孙贵，听到他的上司吴约翰的声音，悄悄地泅水到北岛，正逢蒋军伙夫交连升被上司拷打，于是他又回到了南岛。敌舰长为了拖延时间，等待援兵，提出与王永智等谈判，同时派人前来探听虚实，伺机下手，但其阴谋却被胆大心细的指导员王永智所粉碎。接着，蔡大爷在交连升的帮助下逃到南岛。俘虏孙贵活捉了敌水兵张发子，在敌艇前来援救时，王永智等又冒充援兵，使敌人上勾，将敌全歼，交连升也被解放过来。
kuang deng,矿灯,1959,Beijing Film Studio,Feature,13,在英帝国主义统治下的华北某煤矿，矿工过着悲惨的生活，生命毫无保障。矿工的儿子路子十三岁就失去了父母，为了生活，被迫当矿工。在大风雪呼号的寒夜，路子和他的小伙伴石头、顺子、二豆子几个童工无家可归，围着烤白薯的炉子过夜。老矿工王福厚给予这些孩子慈母般的照顾。抗日战争时期，日本帝国主义以军事武力统治了煤矿，更加残酷地剥削工人。王福厚由于年老，被监工活活地喂了狗。路子他们自发地去杀监工，为王福厚报仇，结果不但没有把监工杀死，石头反而送了命。后来在地下党员傅东山的启发和教育下，矿工们进行有组织的罢工，取得了胜利。
fei yue tian xian,飞越天险,1959,Beijing Film Studio,Feature,11,解放初期，人民空军以缴获的旧飞机试航北京-拉萨。先遣气象组的徐瑞等，因冰山崩裂，被困于山中。部队党委派徐瑞的爱人、飞行员赵忠凯和张启良前往营救，并结合开辟航线。第一次飞行，由于飞机发动机发生了故障而失败。第二次飞行又因气象变化而返航。鲁莽的张启良急于要救出气象组的同志，对赵忠凯决定返航很不满意，两人产生了矛盾。第三次经过艰苦飞行，将物资空投给被困的同志。归途中氧气不够了，在生死关头，他们表现了对祖国的无限忠诚和高度的阶级友爱精神，终于战胜了死亡，胜利归来。
