Key,Film Title,Year,Production,Type,Topic,Plot Summary
zhou xin fang de yi shu sheng huo,周信芳的艺术生活,1956,Shanghai Film Studio,Artistic Documentary,1,京剧表演艺术家周信芳一八九五年出生于扬州，六岁学艺，七岁登台演出，艺名{QUOTE}七龄童{QUOTE}。十一岁改名麒麟童。十三岁成为主要演员，在北京加入{QUOTE}喜连成科班{QUOTE}。辛亥革命前夕，回到上海，受到爱国艺人的影响，开始了他战斗的一生。{LINE_CUT}五四运动前后，他演出了《宋教仁遇害》、《王莽篡位》、《学全打金刚》等戏，痛斥卖国贼袁世凯、曹汝霖。{QUOTE}九·一八{QUOTE}事变后，他编写了《洪承畴》、《徽钦二帝》、《明末遗恨》等剧，还积极参加了上海戏剧界的救亡运动。一九四九年，周信芳应邀出席中国人民政治协商会议；一九五二年，获得全国戏曲观摩演出大会荣誉奖；一九五三年赴朝鲜慰问演出；一九五四年当选为第一届全国人民代表大会代表；一九五五年，文化部和文联、戏剧协会联合主办了{QUOTE}梅兰芳周信芳舞台生活五十年纪念会{QUOTE}。周信芳先生深受人民群众的尊敬。
an tang ren mu,庵堂认母,1956,Shanghai Film Studio,Opera,11,尼姑王志贞十六年前与秀才申贵升相爱，后来贵升不幸病亡。{LINE_CUT}志贞生下一子，因庵规不许养儿育女，她只得写下血书一封，忍痛把孩子丢在路旁。孩子被人拾去，取名徐元宰。十六年后，元宰中了解元。一天他偶然发现血书，才知道生母是尼姑志贞。元宰访母来到法华庵，志贞见元宰的面貌很像当年的贵升，元宰也得知她的法号与母亲相同，便借为观音大士上香，说出了自己的身世。志贞听后非常激动，但因庵中规戒森严，不敢相认。她跑回房中，对着贵升遗像痛哭。元宰冲进房中，见父遗像，掏出血书，跪在志贞面前恳求相认。母子终获团圆。
ge ma,葛麻,1956,Shanghai Film Studio,Opera,6,葛麻在地主马铎家里做工，对马铎的刻薄势利、欺压乡民行为非常愤恨。{LINE_CUT}马铎在发财前，曾把女儿许配给穷书生张大洪；发财后，企图退掉这门亲事，将女儿另配高门。一天，马铎叫葛麻把张大洪找来，想逼张写下退婚字据。葛麻决心帮助表弟，他设下圈套，准备狠狠处置马铎一顿。{LINE_CUT}张大洪到了马家，葛麻机智地使马铎送给张大洪一件最漂亮的衣服和二十两银子，并假装帮马铎打张大洪，拳头却落在马铎身上。他还凭着聪明伶俐的口齿，使马铎没有办法逼张大洪写退婚字据。随后，葛麻又巧妙地探出马小姐对张大洪的爱情和对嫌贫爱富的父亲的憎恨，帮助马小姐逃出家门，与张大洪结成夫妻。
chong po li ming qian de hei an,冲破黎明前的黑暗,1956,August First Film Studio,Feature,1,一九四二年，冀中八路军某排排长阎志刚负重伤，被李大娘和儿媳凤霞所救。阎志刚伤愈后领导游击队与日寇斗争，曾一度因胜利滋长了麻痹思想，使队伍受到损失，因而受到领导的批评。后来，他改正了缺点，运用地道战、地雷战等战术，给敌人以沉重的打击。随后，他又智取李家营敌军据点，救出被捕的凤霞。{LINE_CUT}
zhei jue bu shi xiao shi qing,这决不是小事情,1956,August First Film Studio,Feature,2,由六个小故事组成：{LINE_CUT}《七十五号密件》:王参谋是个很不重视保密的人。一次下班前，他赶着要去看电影，匆忙中忘了将{QUOTE}七十五号密件{QUOTE}交给保密员保管，随手塞进了衣袋。保姆在衣袋里发现了密件，偷偷将它交给了一个伪装收破烂的特务。第二天，王参谋正在万分焦急地寻找密件时，公安局的同志前来逮捕伪装成保姆的特务，王参谋这才如梦初醒。{LINE_CUT}《小广播》:我边防战士逮捕了一个偷越国境的特务，在他身上搜出了一份我部队调动的情报。原来有些{QUOTE}小广播{QUOTE}将部队调动的消息到处传，战士小张听到这消息后，想提早取到照片，就麻痹大意地将部队调动的消息转播给了照像馆老板，而照像馆老板正好是一个暗藏的特务。{LINE_CUT}《夸夸其谈的人》:在一次旅途的火车上，军部保卫科科长遇见了两个报社记者，一路上两个记者夸夸其谈，在座的还有一个自称刚从部队转业的女人苏冰。当两个记者去餐车吃饭时，苏冰偷走了他们的有关国防秘密的海防军事照片，悄悄地溜下了火车。保卫科长将失密情况及时报告公安局。苏冰终于被逮捕了。{LINE_CUT}《失职的哨兵》:某汽车团在紧急的运输任务中，接连发生了两次汽车事故。原来是在晚上观看文工团慰问演出时，值班放哨的司机孙亮贪玩，偷偷地爬上车顶看演出，特务乘机扎破了两辆卡车的刹车皮管，造成了两起事故。{LINE_CUT}《如此恋爱》:某部杨助理员打仗勇敢，立过战功。为了解决个人的婚姻问题，多方面托人介绍对象，条件是年轻、漂亮、有文化。他的一个同乡替他介绍了一个合乎{QUOTE}理想{QUOTE}的女友。在这位女友美色的诱惑下，他完全丧失了警惕，把部队绝密文件拿给女友看。后来，在组织的帮助下，他才知道这个女友是个台湾派来的特务。{LINE_CUT}《小迷糊》:某军火仓库哨兵小胡，外号叫小迷糊。一次，小胡在哨位上又睡着了，特务乘机剪开了铁丝网，钻了进来，用木棍击晕了小胡，在仓库门口点燃了炸药。恰在此时，查哨的排长发觉了，他们及时逮捕了特务，掐断了导火索，使得仓库免遭破坏。
you yuan jing meng (1956),游园惊梦,1956,Central Newsreel and Documentary Film Studio,Feature,3,一个不遵守制度的游客，大闹动物园。当他向猴子掷糖时，却把手表甩进了猴子笼里，手表被猴子咬碎了。他在路上乱扔香蕉皮，自己却被香蕉皮滑倒，被摔得腰酸腿痛。他想找个地方歇歇，明明看见牌子上写着{QUOTE}椅子上不许躺卧{QUOTE}，却往上一躺进入梦乡，他梦见自己训练大象吹口琴，不料口琴被大象吞进肚里。在狮虎山，他到处乱钻，跌进了虎山，本想出来，却又钻进了虎笼，被老虎吓得魂不附体。他好容易逃出虎笼，又遇到一条鳄鱼张着大嘴向他逼来。他慌忙爬上树，头顶上的老鹰又展翅要啄他，他急呼救命，突然有人拍他一把，才把他吓醒。原来这是一场惊险的游园梦。
huang hua ling,黄花岭,1956,Central Newsreel and Documentary Film Studio,Feature,7,贫农宋二嫂早年丧夫，独自靠黄花岭的梨园维持生活。当她遇到困难，去向丈夫的哥哥富农宋福山求援时，宋福山欺凌弟媳贫穷孤寡，想乘机霸占她的梨园，并阻挠她加入农业生产合作社。农业生产合作社主任李洪奎热情地帮助宋二嫂，使她很受感动，要求入社。李洪奎的叔叔李春堂，听信宋福山的甜言蜜语，以宋二嫂穷困为由，反对她入社，为此受到李洪奎的批评。宋二嫂揭露了宋福山阻拦她入社，企图霸占她的黄花岭梨园的阴谋。李春堂猛然醒悟。宋福山见阴谋被揭露，就污蔑李洪奎霸占宋家的寡妇，不准宋二嫂带走财产。宋二嫂毅然冲破旧礼教的束缚，加入了合作社。
bao feng zhong de xiong ying,暴风中的雄鹰,1957,Changchun Film Studio,Feature,15,一九三六年，红军长征后续部队的部分战士为马步芳的军队所俘。红小鬼火娃及战士张大顺、小武等逃出，得到藏族老猎人老巴尔的保护。藏族中的富户多汤父子，主张把红军交给马步芳的军队。为此，老巴尔与多汤父子展开了争论，头人百户不得不同意将火娃等放走。这时，马步芳的军队来搜捕红军。老巴尔协同红军打死了搜捕的三个敌人。敌军狗营长要活埋被俘的红军刘指导员等，老巴尔父子及火娃等救出刘指导员。敌人把老巴尔的儿子华尔丹等抓进牢里，百户也责怪老巴尔不该留下红军。刘指导员及火娃为不连累部落，要求交出自己换回华尔丹。百户很受感动，前往狗营长处交涉，反遭诬蔑，回来后准备和红军一道与敌人打仗。刘指导员带领火娃、张大顺混入敌营，救出华尔丹等。狗营长率兵抢劫部落，杀死了百户，并调来更大的兵力，企图围歼红军。红军战士与藏民联合起来打击敌人。战斗中，为掩护藏民安全转移，红军战士全部牺牲。
ji jing de shan lin,寂静的山林,1957,Changchun Film Studio,Feature,4,美国间谍组织派遣女特务李文英，借还乡照顾子女为掩护，从香港潜入东北，利用金钱物质和媚态诱惑拉拢一些人，准备迎接美国的空投特务。我侦察人员史永光得知敌人的阴谋后，冒充跑行商的商人冯广发，通过女特务李文英，深入香港的敌特巢穴，经受种种考验，博得美帝特务头子皮斯利的信任，掌握了敌人的全部阴谋，还把一个对敌持有反感情绪的特务训练生郭大用争取到自己一边。最后，冯广发利用敌人派他执行空投任务之机，配合公安部队和民兵，逮捕了全部美蒋空投特务。
wei wan cheng de xi ju,未完成的喜剧,1957,Changchun Film Studio,Feature,7,两个全国闻名的喜剧演员到长春电影制片厂参观学习，观看了三个讽刺剧：第一个小故事讽刺一个好逸恶劳、铺张浪费的领导干部朱经理和溜须拍马的杨秘书；第二个小故事讽刺吹牛夸张的人；第三个小故事讽刺一对抛弃老母不管的兄弟。陪同看戏的批评家对这三个讽刺剧打棍子、扣帽子。
fu shi (1957),复试,1957,Changchun Film Studio,Feature,14,音乐学院严教授在招考时，发现应试的考生陆小梅很有歌唱天才，但复试时，陆小梅却因嗓子哑而未被录取。严教授深入到陆小梅的家和所在工作单位进行调查了解，原来在复试的前一天，陆小梅为抢救受台风袭击的受难者，彻夜未眠，使嗓子受到影响。最后，严教授录取了她。
qing chun de jiao bu,青春的脚步,1957,Changchun Film Studio,Feature,6,某民用建筑设计院的技术员林美兰与肖平相爱，由于工人住宅设计意见的分歧，两人闹了一点小意见。肖平的表哥彭珂借帮助之名向美兰求爱。美兰知道彭珂已有妻子儿女，拒绝了彭珂而与肖平和好了。后来因为肖平批评了她，伤了她的虚荣心，她再度与肖平疏远。彭珂乘机占有了美兰，并逼迫妻子淑芳离婚。不久，美兰怀孕，彭珂为了顾全自己的名誉和地位，逃避在道德上应负的责任，竟让美兰服药打胎，幸被及早发现，才免于生命的危险。最后，彭珂的道德败坏行为受到法律惩处，美兰也认识到自己严重的资产阶级思想，决心改正错误，振作起来。
xun ai ji,寻爱记,1957,Changchun Film Studio,Feature,8,零售公司的售货员李勇和百货公司的收款员赵惠，在去参加先进工作者会议的途中发生撞车事故。意外的事故使他们俩相识，并产生了爱情，经过曲折的了解后，结成美满夫妻。赵惠的同事马美娜和李勇的同事张士禄都不安心商业工作，认为售货员是低三下四伺候人的工作，没有出息。马美娜一心想找一个理想中的爱人，好借此调动工作。在一次舞会上，她认识了自称人事科长的张士禄，他们很快地由恋爱而结婚。在结婚典礼上，马美娜终于发现张士禄不是人事科长，而是她认为没有出息的售货员，她非常懊悔。经过李勇和赵惠诚恳地批评和劝导，两人最后都认清了自己的错误思想，并且美满的生活下去。
di xia jian bing,地下尖兵,1957,Changchun Film Studio,Feature,11,北平解放前夕，我地下组织{QUOTE}红松组{QUOTE}领导人陶干，为弄清由南京特派的国民党军统特务专员邹至甫从美军顾问所带来的重要军事情报，化名钱铸久，以{QUOTE}永裕贸易行{QUOTE}经理职业为掩护打入敌人内部。陶干以给敌十一战区副参谋长宋欣倒卖黄金为名去宋家，见到化名刘国栋的特务专员邹至甫，企图探听一些情况，但由于邹至甫的老练阴险，使陶干的计划落空。邹至甫为避免军事计划被共产党弄去，叫国民党嫡系部队第六军军长沙振武亲自来北平面授任务。与此同时，为了计划的顺利执行，他一面叫特务田队长搜查我地下秘密电台，一面叫叛徒王守忠用假军事计划来吸引我们、给我地下组织造成了损失。陶干通过我打入敌长官部的艾永伯探听到敌人制定军事计划的助手是孙思义，便略施小计，让宋欣撤掉了孙思义，使艾永伯取而代之。艾永伯把敌六军撤退的日期告诉了陶干。不久，艾永伯引起邹至甫的猜疑，邹至甫为了破坏我地下组织和迷惑我们，便制造假情况，佯言六军撤退的日期后延。为了证实撤退日期后延的情报，陶干冒险去舞场找艾永伯，并巧妙地通过沙军长小老婆之口，了解到敌人改变计划是假的。这时，邹至甫率特务来抓陶干，艾永伯为掩护陶干送出情报，破坏了舞场的电闸，负伤被捕，光荣牺牲。我军根据陶干的情报，将敌六军歼灭在调防途中。
lu sheng lian ge,芦笙恋歌,1957,Changchun Film Studio,Feature,10,在我国云南省澜沧江流域居住的拉祜族人民，解放前受尽了国民党军队的欺凌压迫。拉祜族的青年猎手扎妥和美丽的姑娘娜娃相爱。国民党军队的烧杀抢掠，激起拉祜族青年的反抗，但是土枪弓箭怎能抵挡得住美式装备的蒋军呢？结果，寨子被烧，人遭屠杀。阿七爹带领着娜娃和寨子里的老幼妇孺离乡背井，另觅安身之处。年青力壮的拉祜族青年被赶进原始老林。国民党军队又乔装成拉祜族的难民来偷袭。除了扎妥侥幸逃脱外，其他的青年全被杀死。扎妥为了报仇，在老林深处过了两年茹毛饮血的原始生活。解放后，一支地质勘探队来到此地寻找矿藏，发现了一个行踪诡秘、来历不明的野人。他们跟踪到老林深处，在棚屋里发现一个芦笙和勘探队正在寻找的一块矿石，带路的阿七爹证明这个野人正是两年前失踪的扎妥。但扎妥却梦想不到来找他的是自己的亲人，他不断地射箭抵抗，对乡亲们的喊声也置若罔闻。这时，娜娃拿起芦笙吹奏起当年他们相爱时的恋歌，扎妥闻声如梦初醒，悲喜交集。这一对饱经艰难的情侣，终于幸福地团聚了。
bian zhai feng huo,边寨烽火,1957,Changchun Film Studio,Feature,3,在我国西南边境居住的景颇族人，由于长期受国民党的统治和压迫，对汉族人抱有很深的怀疑和仇恨。我边防军某连为帮助景颇族弟兄改变刀耕火种的原始生产方式，提出修建水闸引水开田的计划。头人梅普山官的儿子多隆受特务戈当的挑唆，对我边防军采取敌对行动。戈当借我军医务人员李医生为多隆的儿子治病之机，暗中下毒，以嫁祸于人。多隆不明真象，更加仇恨我军，因企图杀害李医生未遂，竟过河投敌。后来，多隆的儿子被李医生救活。梅普山官很感激，当即表示愿意共修水闸。多隆潜回家乡进行破坏时，始知真情，立誓带罪立功。戈当得知多隆回寨后的活动，企图炸水闸，梅普山官识破了他的诡计。最后，多隆将数百名国民党兵带进我军布下的包围圈，将其全部歼灭。
mu nv jiao shi,母女教师,1957,Changchun Film Studio,Feature,7,沈淑严和林月英母女都是乡村的小学教师。母亲沈淑严三十年来把自己的全部力量都献给了乡村的教育事业，她现在已是满头白发的老校长了。女儿林月英初出茅庐，怀着极大的热情走上这个神圣的工作岗位。在教育学生的问题上，当校长的母亲主张对学生要严，认为{QUOTE}不严则不成器{QUOTE}。当教员的女儿则主张谆谆善诱和热情帮助。为此，母女之间发生了矛盾。后来，母亲因错误地开除学生王大毛感到内疚而提出辞职。在党和政府的信任、鼓励与同事们诚意的挽留下，沈校长认识到自己的错误，母女之间也获得了谅解。
mu ren zhi zi,牧人之子,1957,Changchun Film Studio,Feature,9,复员军人德力格尔回到了故乡内蒙古草原上的银河村任村长，提出发展草原牧场的计划。只顾眼前利益而不顾长远和集体利益的富裕户阿尔斯郎等，对此进行反对和破坏。副社长阿木嘎为追求德力格尔的情人格根涛娅，也不择手段地阻挠和反对发展草原牧场。官僚主义的卜仁区长怕负责任，片面地相信副社长阿木嘎的话，以简单粗暴的态度撤了德力格尔的村长职务。工作上和爱情上的挫折，使德力格尔消极、沮丧。后来，曾因一度误会的格根涛娅来找德力格尔，两人重新和好，使他得到了精神力量。经村党支书特戈希的帮助，在旗党委的支持下，德力格尔又站了起来，领导群众，将银河修成，实现了发展草原牧场的计划。
li er sao gai jia,李二嫂改嫁,1957,Changchun Film Studio,Opera,12,一九四七年山东解放区的一个村庄。年轻寡妇李二嫂的婆婆外号叫{QUOTE}天不怕{QUOTE}，常常指鸡骂狗，刁难和折磨二嫂。二嫂忍气吞声地每天从早忙到晚。在共同劳动中，她与本村民兵积极分子、劳动能手张小六有了感情，但由于封建礼教残余的影响和担心群众的议论，两人都没敢吐露真情。{LINE_CUT}张小六报名参加了支前担架队。二嫂知道后，约他晚上到自己家里去，想把心事告诉他。谁知见面时由于羞愧心理作祟，谁也不好意思谈到婚事。正在这时，{QUOTE}天不怕{QUOTE}闯进屋来，两人只好匆匆分别，然而双方已经会意。{LINE_CUT}{QUOTE}天不怕{QUOTE}一心想拦阻二嫂改嫁，她乘小六去支前的机会，和诡计多端的李七一起来到张大娘家，给张小六另提亲事。二嫂得知张大娘已经答应另一门亲事时，悔恨自己不该对婚事畏畏缩缩。经过这一打击后，她下决心要冲破封建残余势力，去争取美好的生活。正在这时，她的生母刘大娘听信李七的谣言，以为小六真是个二流子，便来到{QUOTE}天不怕{QUOTE}家，阻拦二嫂改嫁。幸亏妇救会主任向刘大娘揭示了真相，刘大娘才同意女儿改嫁。{LINE_CUT}张小六完成支前任务回来后，坚决反对母亲给他提的亲事，加上妇救会主任对张大娘的帮助，张大娘决定去退亲。{LINE_CUT}正当刘大娘和{QUOTE}天不怕{QUOTE}在为二嫂和张小六的亲事争吵时，张大娘赶来，三人当场对质，揭穿了{QUOTE}天不怕{QUOTE}给小六和二嫂造的谣。李二嫂和张小六这对情人，在群众的支持下，终成眷属。
hu die bei,蝴蝶杯,1957,Changchun Film Studio,Opera,6,知县田云山的儿子田玉川在龟山游览时，见到总督卢林的儿子因强买娃娃鱼，把渔翁打得奄奄一息。玉川在给渔翁解围时，失手打死了卢公子，玉川一看事情不妙，连忙躲避起来。{LINE_CUT}渔翁之女胡风莲见到父亲身上鲜血淋淋，急问原由，渔翁把经过情形告诉了女儿，再三嘱她报仇伸冤，而后死去。此时，总督府已封锁江面，围住了龟山，要捉拿玉川。玉川惊慌逃向江边，恰巧凤莲的船只停靠在此，凤莲得知他就是搭救父亲的恩人，毫不犹豫地把他藏进船舱里，勇敢而巧妙地以父亲尸体作掩护，骗过官兵的搜查。{LINE_CUT}夜深人静，玉川和凤莲对坐船上，凤莲一心要为父报仇，要求玉川帮她出主意。玉川想替她写张状子，但没有笔砚，正焦急间，偶然触到身边的蝴蝶杯，想让凤莲拿杯到父亲的县衙去告状，又想到母亲曾嘱他将此杯作为聘礼使用，于是他经过一番考虑，便以杯为信物，与凤莲订了白头之约。{LINE_CUT}凤莲来到县衙，在田夫人和知县面前哭诉了父亲被卢世宽打死及玉川为救她父亲失手打死卢世宽的经过，同时也吐露了与玉川定盟之事。夫人听了心里倒也欢喜。{LINE_CUT}此时，卢林派兵来传田云山，要他捉儿子归案。五堂会审时，田云山据理申辩，得到布政司董温的支持。这时凤莲闯进公堂，控诉卢世宽杀死她父亲的罪状，家郎也进行了对证。卢林虽知理亏，但仍坚持己见，正在相持不下的时候，忽然圣旨传下，要卢林挂帅出征。这件案子也就此终止了。
jie nian,借年,1957,Changchun Film Studio,Opera,6,书生王汉喜因家境贫寒，大年除夕奉母命到岳父家去借年。他见岳父家正在欢度新年，深感自己处境寒酸，徘徊不前。这时突闻有人走来，他慌忙误入爱姐闺房回避。恰巧来人正是他的未婚妻爱姐和陪她一同回闺房安歇的嫂子。{LINE_CUT}爱姐因思念贫困中的未婚夫，坐在闺房中闷闷不乐，嫂子想尽办法使爱姐愉快，并答应愿意成全小姑的婚事，她还怕小姑大年除夕一人孤单，欲陪同小姑入寝。此时回避在暗处的汉喜暗暗着急，幸亏爱姐婉言拒绝了嫂子的好意。{LINE_CUT}爱姐送走嫂子，回到屋内，独自哭诉自己的心事，汉喜甚为感动，他不自觉地从暗处走出，使爱姐大吃一惊。当爱姐认出此人正是自己所思念的未婚夫时，忙问明来意，随后赠送许多年货和银子，并留汉喜喝辞岁酒。两人边喝边谈论终身大事。不料嫂子在窗外早已看清室内情景，她在窗外故意喊爱姐起来下饺子，屋内两人惊作一团，汉喜只好藏进衣橱内。其实嫂子早已有意成全两人，她见爱姐故作正经，便打开衣橱把汉喜拉了出来。爱姐和汉喜在嫂子的戏弄之下，窘态百出。最后，这对未婚夫妻终于在嫂子的关怀和支持下，结为夫妇。
qun ying hui,群英会,1957,Beijing Film Studio,Opera,13,《群英会》是小说《三国演义》中的一段。{LINE_CUT}曹操率八十三万人马，要消灭夏口的刘备和东吴的孙权。刘备与孙权联合应战，遂派孔明来到东吴。东吴都督周瑜，奉命御敌于三江口。周瑜少年英俊，忌孔明比自己才高，而自信有破曹的把握。因此，想杀孔明以绝东吴后患。{LINE_CUT}曹营谋士蒋干，以为和周瑜有同窗友谊，自愿过江劝说周瑜降曹。周瑜知道蒋干来意，夜间和蒋干同榻而卧，故意让他发现一封曹营水军头领蔡瑁、张允给周瑜的信，信上说将杀曹操而后来降。蒋干盗了这封假信，逃回曹营。曹操见信，斩了蔡瑁、张允，但随即觉悟到中了周瑜的诡计，便派蔡瑁的兄弟蔡中、蔡和去江东诈降。{LINE_CUT}周瑜以为自己的妙计无人知晓，不料孔明一见面就庆贺他{QUOTE}借刀杀人{QUOTE}成功，为此，周瑜更忌孔明。他借口军中缺箭，让孔明在一月内造十万枝箭。孔明却答应在三天之内造成，否则愿受军法处置。次日，孔明向鲁肃借快船二十只，外蒙帐幔茅草，在浓雾之中驶近曹营，擂鼓呐喊。曹操以为周瑜来偷营，命部下乱箭齐发，箭都射在草船上。孔明在霎时得到了十万枝利箭。{LINE_CUT}蔡中、蔡和来降，周瑜发觉其中有诈，就将计就计，把两人留下。随后和老将黄盖定下诈降曹营的苦肉计。在庆贺孔明借箭回营的宴席间，黄盖故意力主降曹，周瑜假装大怒，责打黄盖。{LINE_CUT}黄盖被打后，请大夫阚泽去曹营下诈降书，曹操发觉信中有诈，欲杀阚泽。但阚泽机智镇定，从容对答。正在这时，蔡中、蔡和将周瑜打黄盖的消息密报曹操，曹操这才接受黄盖投降。但他仍不放心，又派蒋干再次过江，打听实信。{LINE_CUT}周瑜和孔明决定火攻曹营，遂与庞统定下连环计，让庞统在蒋干面前说周瑜不能容人。蒋干劝庞统归曹，于是两人连夜潜回曹营。庞统劝曹操将满江战船连锁起来，以便不惯乘船的北军也能水战。曹操采纳了此项建议。{LINE_CUT}周瑜闻曹操中连环计，十分得意。不料一阵西北风提醒他：吴军位于东南，曹军位于西北，若用火攻，必烧自己而不能破敌，遂忧虑成疾。孔明写了一张{QUOTE}病源{QUOTE}给周瑜：{QUOTE}欲破曹兵，须用火攻；万事俱备，只欠东风{QUOTE}。周瑜一看，病体即愈。孔明自言能借东风。就在孔明借风时，周瑜派将士埋伏山后，等东风一起，就杀孔明。可是孔明早料到周瑜有此一招，东风起时，他就悄悄逃到江边，乘赵子龙备好的船只回转夏口去了。
